{
  "experiment_id": "option-3-09-container-dirty-refresh",
  "lane": "09-container-dirty-refresh",
  "workload": "container-dirty-refresh",
  "command": [
    "cargo test -p egglog-core-relations nonincremental_dirty_ids_only_include_stable_ids -- --nocapture",
    "cargo run -- tests/container-rebuild.egg",
    "cargo run -- tests/container-fail.egg",
    "cargo run -- tests/vec.egg"
  ],
  "repo_state": {
    "root": "/Users/saul/p/egglog-dataflow/repos/egglog",
    "git_head": "cd50379",
    "git_dirty": true,
    "notes": "Workspace already had unrelated untracked files under code/option3-overlap/ and findings/artifacts/option-3/."
  },
  "semantic_ok": true,
  "freshness_ok": true,
  "early_visibility_violations": 0,
  "barrier_count": 0,
  "barrier_reasons": [],
  "runtime_us": 1897907,
  "metrics": {
    "key_question": "Does same-id container dirty refresh preserve seminaive visibility?",
    "option_implication": "Container refresh needs an equivalent first-class invalidation signal. The native dirty_ids split is oracle evidence for the behavior, not a required implementation shape for a replacement backend.",
    "performance_summary": "Four container dirty-refresh checks passed in 1897907 us total.",
    "runs": [
      {
        "command": "cargo test -p egglog-core-relations nonincremental_dirty_ids_only_include_stable_ids -- --nocapture",
        "exit_code": 0,
        "runtime_us": 98699,
        "notes": "Unit test passed."
      },
      {
        "command": "cargo run -- tests/container-rebuild.egg",
        "exit_code": 0,
        "runtime_us": 594143,
        "notes": "Direct egglog run exited 0."
      },
      {
        "command": "cargo run -- tests/container-fail.egg",
        "exit_code": 0,
        "runtime_us": 578007,
        "notes": "Direct egglog run exited 0."
      },
      {
        "command": "cargo run -- tests/vec.egg",
        "exit_code": 0,
        "runtime_us": 627058,
        "notes": "Direct egglog run exited 0."
      }
    ],
    "observations": {
      "dirty_ids": {
        "same_id_case": [
          "old_id"
        ],
        "changed_id_case": []
      },
      "same_id_vs_changed_id": {
        "same_id_dirty_ids": 1,
        "changed_id_dirty_ids": 0
      },
      "refresh_rows": null,
      "row_retractions": null,
      "row_reinserts": null,
      "rebuild_index_hits": null
    },
    "limitations": [
      "Current binaries do not expose a direct refresh-row counter or row retraction/reinsertion counters.",
      "The unit test confirms the same-id vs changed-id split; the actual refresh-row count is source-inferred from the table refresh path."
    ]
  },
  "verdict": "Supported by source and runtime checks; same-id dirty_ids are confirmed and align with the refresh-lane design."
}
