{
  "experiment_id": "option-3",
  "lane": "08-custom-scheduler-backoff",
  "workload": "custom-scheduler-backoff",
  "command": [
    "cargo test -p egglog-experimental --test files math_backoff -- --exact --nocapture",
    "cargo test -p egglog-experimental --test files repro_scheduler_scopes -- --exact --nocapture",
    "cargo test -p egglog --test files schedule_demo -- --exact --nocapture"
  ],
  "repo_state": {
    "root": "/Users/saul/p/egglog-dataflow",
    "git_head": "cd503798919131c1c8f66760cb18c561bd6cb2d2",
    "git_dirty": true,
    "notes": "Workspace already had untracked option-3 artifacts and generated build output before these lane files were written."
  },
  "semantic_ok": true,
  "freshness_ok": true,
  "early_visibility_violations": 0,
  "barrier_count": 2,
  "barrier_reasons": [
    "math_backoff: full-match materialization is admitted when the match count stays at or below the threshold, then banned with exponential backoff when it exceeds the limit.",
    "repro_scheduler_scopes: scheduler bindings are scoped through repeat/saturate blocks and run-with resolves the most recently bound scheduler name."
  ],
  "runtime_us": 5817000,
  "metrics": {
    "key_question": "Do custom scheduler/backoff semantics require full-match admission boundaries?",
    "option_implication": "Custom scheduler behavior remains native-boundary evidence; DD lowering must preserve materialization, admission, and delayed firing.",
    "performance_summary": "Three scheduler/backoff runs passed in 5817000 us total.",
    "summary": "Custom scheduler/backoff lanes behaved as designed: the back-off scheduler admitted full-match materialization, then banned and later unbanned rules with exponential backoff, and scheduler scope handling stayed local to each nested schedule block.",
    "runs": [
      {
        "name": "math_backoff",
        "pass": true,
        "runtime_us": 5611000,
        "evidence": [
          "final print-size included large match counts: Add 24991, Mul 14823, MathU 2645, is-not-zero 48",
          "final extract returned (Const (rational 1 1))"
        ]
      },
      {
        "name": "repro_scheduler_scopes",
        "pass": true,
        "runtime_us": 206000,
        "evidence": [
          "scheduler declarations inside repeat and saturate both ran successfully",
          "the final output showed ((R 10))"
        ]
      },
      {
        "name": "schedule_demo",
        "pass": true,
        "runtime_us": 1665000,
        "evidence": [
          "left reached 10 and right reached 9 under nested saturate/repeat scheduling",
          "the intentional fail checks still failed as expected"
        ]
      }
    ],
    "tested_repos": {
      "egglog-experimental": {
        "root": "/Users/saul/p/egglog-dataflow/repos/egglog-experimental",
        "git_head": "eae9570d78105c53497fccdf0ff7fb1937592036"
      },
      "egglog": {
        "root": "/Users/saul/p/egglog-dataflow/repos/egglog",
        "git_head": "b27cd225ba3d646ff4327d076c7def665eadb232"
      }
    },
    "source_evidence": {
      "schedule_state": "repos/egglog-experimental/src/scheduling.rs:42-47,77-190",
      "backoff_logic": "repos/egglog-experimental/src/scheduling.rs:242-394",
      "admission_rule": "filter_matches chooses all matches when total_len <= threshold; otherwise it increments times_banned and bans the rule for exponentially longer intervals",
      "scoping_rule": "new_scope truncates the scheduler stack after repeat/seq/saturate blocks, and run-with resolves the newest scheduler binding with rfind"
    },
    "limitations": [
      "The experimental file harness does not initialize env_logger, so the back-off info logs were not emitted in the test output; the implementation evidence comes from the source and the observed workload results.",
      "The `schedule_demo` run is supporting schedule-boundary evidence, not a custom back-off test."
    ]
  },
  "verdict": "The back-off scheduler and scheduler-scope handling both behave as intended."
}
